,write_time,title,brief,content,href
0,2023-01-12,Stocks Climb After Inflation Data - WSJ,"Federal Reserve appears poised for a smaller quarter-point interest-rate increase</h2>, <h2 class=""sc-jTzLTM jTnwvo"">We want to hear from you","U.S. stocks climbed Thursday after the latest inflation data showed cooling price pressures for the sixth consecutive month, likely keeping the Federal Reserve on track to slow its pace of interest-rate increases.The S&amp;P 500 added 13.56 points, or 0.3%, to 3983.17, while the Dow Jones Industrial Average gained 216.96 points, or 0.6%, to 34189.97. The technology-heavy Nasdaq Composite rose 69.43 points, or 0.6%, to 11001.10. The indexes bobbed between gains and losses early in the session before gaining steam midday.Consumer-price inflation slowed to 6.5% in December, down from 7.1% in November, the Labor Department said. Despite landing largely in line with economists expectations, one measure of services inflation-excluding energy services and the cost of owning or renting a home-offered encouragement that tighter monetary-policy is proving effective. So-called supercore inflation, flagged by Federal Reserve Chairman Jerome Powell as especially important given its sensitivity to labor costs, rose at a 3% annualized rate, well below the pace seen last year. Many economists have noted it is normal to see a delay in housing prices falling substantially.In response to the data, traders grew more confident that the Fed is on course to slow its pace of tightening at its coming meeting. Wall Street widely expects the central bank to raise its benchmark rate target by a quarter of a percentage point to a range between 4.5% and 4.75% on Feb. 1.The data was ""a mixed bag when you dig into the nuance,"" said Andrew Patterson, senior economist at Vanguard. Mr. Patterson added he will be closely watching Fed officials comments between now and the end of the month to get a better sense of where the Fed might be headed.Thursdays rally extends the S&amp;P 500s gains for the month to 3.7%. Energy stocks fared best of the indexs 11 sectors, rising 1.9% alongside higher oil prices. Brent crude-oil futures gained 1.6% to $84.03 a barrel.Investors scooped up U.S. Treasurys, lifting bond prices and weighing on yields. The yield on the 10-year U.S. Treasury note slipped to 3.446% from 3.554% late Wednesday, while the yield on the two-year note-which is more sensitive to monetary-policy expectations-fell to 4.138% from 4.226%. Market-based expectations are for the Fed to cut rates by roughly a half-percentage point in the latter half of the year, according to derivatives prices via FactSet. Yet some policy makers have pushed back on the chance of any rate decreases in 2023, saying borrowing costs will have to stay high for some time to bring down inflation.""The market is battling against them,"" said Lyn Graham-Taylor, senior rates strategist at Rabobank. ""Its easing financial conditions,"" when Fed officials want the opposite, he said.Global investors wagered that a less-aggressive Fed would be a boon for assets that had suffered from the support rising rates provided for the dollar.The yen rose 2.4% against the greenback, supported by speculation that the Bank of Japan could retreat from its ultra-lenient monetary policy. Front-month gold futures jumped 1.1% to $1895.50 a troy ounce, their highest close since April 2022. The dollar extended recent declines. The WSJ Dollar Index dropped 0.9% to its lowest level since June 2022. Speculators have piled into bets against the dollar and in favor of gold lately, hoping for a reversal of 2022s performances.Options traders took a breath of fresh air after the print, seeing fewer catalysts to jostle stocks on the horizon. The Cboe Volatility Index, or the VIX, extended its longest lull since late 2021 by falling below 20-a level typically seen as signifying lack of worry or complacency-to 18.83. Elsewhere, airline stocks received a boost from American Airlines improved earnings guidance, which sent shares up $1.49, or 9.7%, to $16.83. Overseas markets were broadly higher. The Stoxx Europe 600 extended its strong start to the year, rising 0.6%. In Asia, Hong Kongs Hang Seng rose 0.4%. Japans Nikkei 225 was close to flat, and the Shanghai Composite Index rose less than 0.1%.Write to Eric Wallerstein at eric.wallerstein@wsj.com, Akane Otani at akane.otani@wsj.com and Joe Wallace at joe.wallace@wsj.com",0
1,2023-01-12,The Markets Are Locked in a Game of Chicken With the Fed - WSJ,Investors are betting the Fed will cut interest rates as early as the second half of the year. The central bank says otherwise.,"The Federal Reserve says it is too early to think about cutting interest rates this year. Investors are growing more convinced that is exactly what the central bank is going to do.The clash between investors hopes and Fed policy, and how it ultimately resolves, is shaping up to be one of the biggest question marks for financial markets in 2023.Many money managers predict inflation has peaked, and that price pressures will fall so fast that the Fed takes back some of its interest-rate increases by the end of the year, as it did in 2019 just seven months after its last hike.Fed officials have been hammering a different message: This time will be different because inflation is much higher.The Labor Department said Thursday that its consumer-price index, which measures what consumers pay for goods and services, rose 6.5% in December from a year earlier. That marked its slowest pace since October 2021, and its sixth consecutive monthly decline. Last weeks jobs report also showed wage growth cooled, with average hourly earnings rising at the slowest pace since mid-2021.Evidence that inflation is pulling back has fueled bets that the Fed will cut rates as early as the second half of the year. Traders in interest-rate derivatives markets see a 90% chance that the Fed lifts rates two more times this year, to around 4.9% by March, according to CME Group. They see a 60% chance that the Fed then cuts rates at least once by December.At their meeting last month, Fed officials projected interest rates will continue rising through the spring, to around 5.1%. None of them penciled in cuts this year. They have generally signaled a somewhat more aggressive path for interest rates either because they are less optimistic than investors, who see a speedier slowdown in inflation this year, or because they are less pessimistic about the probability of a serious recession.""To be honest with you, I dont quite know why markets are so optimistic about inflation,"" said San Francisco Fed President Mary Daly after the Feds meeting last month. ""I think of them as priced for perfection,"" she said.The Fed and many investors agree that inflation will keep declining this year as supply-chain bottlenecks abate and as housing costs slow down after soaring over the past two years. But Fed officials are nervous that the labor markets strength could sustain wage growth that keeps inflation, as measured by a separate gauge, above their 2% target.Fed officials, Ms. Daly said, ""dont have the luxury of pricing for perfection…. We have to imagine what the risks to inflation are.""One of her colleagues, St. Louis Fed President James Bullard, echoed that point after Thursdays report was released. ""It could be that inflation starts to go in the other direction again, and then the Fed would have to react to that,"" he said during a webinar. ""I dont think theres enough pricing being put on that possibility.""Investors who are counting on interest rates falling are at risk of being burned if they wind up being wrong.The S&amp;P 500 has risen 11% from its October low, with much of the gains being attributed to bets that the Fed will pivot from raising rates to cutting them some time this year. Government bonds have also retraced some losses after a brutal 2022. The yield on the 10-year U.S. Treasury note was at 3.446% Thursday, compared with its October peak of 4.231%. Yields fall as bond prices rise.Several banks, including JPMorgan Chase &amp; Co., UBS Group AG, and Deutsche Bank AG, are expecting U.S. stocks to post gains this year. But others are cautioning the market could suffer double-digit percentage declines yet again, especially if Fed policy winds up being tougher than investors anticipate, which in turn could cause the economy to slow down more than investors expect.What explains the disconnect between the Fed and much of Wall Street?""It is very simple: The market has a very different view on inflation. It thinks inflation is going to fall much faster than the Fed does,"" said Mark Cabana, the head of U.S. interest-rate strategy at Bank of America Corp.In addition, there are important technical differences in what the Feds quarterly economic and interest-rate projections show relative to what investors anticipate based on readings of interest-rate futures markets.The Feds projections represent what every individual Fed official thinks should happen to interest rates under their modal, or most likely, expectation for the economy. But those projections only reveal how the Fed is likely to respond under one general set of circumstances. Market participants, on the other hand, can make probability-weighted bets in interest-rate futures markets that better take into account different economic scenarios.Fed Chair Jerome Powell has at times emphasized the limitations of the Feds projections.""When uncertainty around the outlook is unusually high, I dutifully write down what I see as the appropriate funds rate path in the most likely scenario, but I do so aware that this projection may be easily misinterpreted, for what is most likely may not be particularly likely,"" he said in 2019.The past year served as a cautionary tale for many investors, with inflation and interest rates racing far higher than most foresaw. ""Think about what the Fed and the market was projecting a year ago,"" said Joe Amato, president of Neuberger Berman Group.The way stocks have bounced back the past few months suggests ""theres a false sense of precision from the equity markets"" on where rates are headed, he said.Many investors also appear to be reluctant to take the Fed at its word, said Sam Lynton-Brown, head of global macro strategy at BNP Paribas SA.""The market has learned that forward guidance for central banks, at a point when theyre data-dependent and the data are volatile, doesnt hold much credibility,"" said Mr. Lynton-Brown. ""Its all about what the data shows,"" and specifically, about whether or not the data suggest inflation will be able to quickly fall to the Feds 2% target, he said. (Mr. Lynton-Brown doesnt believe that will be the case.)The gap between Wall Streets expectations and Fed talk may also stem in part from central bankers reluctance to come across as too optimistic in public.The Fed believes its policies to slow demand and combat inflation work by tightening financial conditions, such as by raising borrowing costs or lowering stock prices and other asset values. Any market rallies that ease financial conditions could potentially hinder officials effort to restrain hiring or wage growth.""The minute the Fed acknowledges inflation isnt a problem anymore, markets will just speed higher,"" which would prolong the Feds job, said Jack McIntyre, portfolio manager at Brandywine Global.At the end of the day, what may matter most for markets isnt how high the Fed raises rates, but how well the economy is able to hold up over the coming year.For instance, Goldman Sachs Group Inc. says if the U.S. narrowly avoids recession, as it expects it will, it sees stocks ending the year just a touch higher. If the economy were to go into recession, Goldman sees earnings growth sliding-in which case, the S&amp;P 500 could fall about 20%, a far different outcome.Write to Akane Otani at akane.otani@wsj.com and Nick Timiraos at Nick.Timiraos@wsj.com",1
2,2023-01-12,ConocoPhillips in Talks to Sell Venezuelan Oil in U.S. to Recover Billions It Is Owed - WSJ,"The Houston-based oil company has had preliminary discussions with Venezuelas state oil firm, PdVSA","ConocoPhillips, which abandoned Venezuela after its assets were nationalized in 2007, is now open to a deal to sell the countrys oil in the U.S. as a way to recover the close to $10 billion it is owed by Venezuela, according to people familiar with discussions between the company and Venezuela representatives.In what are preliminary talks between ConocoPhillips and national oil company Petróleos de Venezuela SA, the two sides are looking at a proposal that could allow the Houston-based company to load, transport and sell Venezuelas oil in the U.S. on behalf of PdVSA, as the state oil company is known. This would give ConocoPhillips a chance to recover the money it lost in the country and help the U.S. meet its energy needs, the people said.The arrangement would help Venezuela end the commercial isolation that was caused by U.S. sanctions leveled against the oil industry in 2019, and further open the U.S. market to its crude. The U.S. had historically been Venezuelas largest oil market until the sanctions, with several big Gulf Coast refineries designed to run its heavy crude. But a sharp yearslong fall in Venezuelan production curbed supply. Then sanctions, imposed by the U.S. in response to human rights violations and democratic backsliding, broke off trade.ConocoPhillips, which has a license from the U.S. Treasury Department to negotiate debt recovery with PdVSA, declined to discuss any deal with PdVSA.""Regarding PdVSA recovery efforts, ConocoPhillips is committed to pursuing all available legal avenues to protect our rights and obtain a full and fair recovery of the awards in recognition of our fiduciary responsibility to our shareholders,"" ConocoPhillips said.In a statement, the State Department didnt answer questions about ConocoPhillips, instead saying U.S. policy is to ""implement and enforce our Venezuela sanctions in support of a return to democracy in Venezuela.""The possibility of a deal between PdVSA and ConocoPhillips comes after the Biden administration issued a license in November to Chevron Corp. to restart oil production and exports from existing joint ventures with PdVSA, marking the first significant easing of U.S. sanctions against Venezuela President Nicolás Maduros government. The Trump administration had barred most Western companies from operating in Venezuela in an effort to dislodge Mr. Maduro from power. He survived with the help of China, Russia and Iran.Now, with Chevron having won a license and starting to load crude, those companies are trying to resume suspended production or expand the limited operations they have maintained in Venezuela.At least a handful of oil-and-gas companies are exploring Venezuelan deals and holding talks with PdVSA, some of which are seeking authorization from the U.S. State and Treasury departments in order to negotiate, according to people close to some of the firms. Among those pressing for U.S. approval to expand operations in Venezuela are Spains Repsol SA and Italys Eni SpA, which produce modest amounts of gas off Venezuelas coast. Representatives for the two companies didnt immediately respond to requests for comments.Elliott Abrams, who served as envoy to Venezuela in the Trump administration, says those European companies want fair treatment from U.S. regulators.""The question is, why is that fair if youre Repsol [or] Eni?"" Mr. Abrams said. ""Ultimately these other companies are going to have to be treated equally by the Biden administration.""In exchange for the Chevron license, Venezuela agreed to discuss a path to free and fair elections in 2024 with the opposition and to clear the way for a $3 billion United Nations-administered humanitarian aid program, which has yet to be implemented.Chevron chose to stay in Venezuela despite the wave of expropriations under Mr. Maduros predecessor, Hugo Chávez, who died in 2013.ConocoPhillips, in contrast, pulled out and later won nearly $10 billion in total international arbitration awards against the Venezuelan state and PdVSA over the seizure of its oil projects.The awards make ConocoPhillips the largest private-sector creditor of Venezuela. For years, the company has aggressively pursued enforcement of its claims by imposing liens on Venezuelan assets around the world. Under a 2018 settlement agreement for a $2 billion award, PdVSA paid ConocoPhillips $774 million before halting payments, blaming sanctions.Venezuela is ""totally ready to take steps toward a process of normalization of diplomatic, consular and political relations"" with Washington, Mr. Maduro said in a recent interview on state television.ConocoPhillips isnt considering going back into Venezuela to pump oil, at least for now, despite opportunities floated by PdVSA, including gas deals, according to the people familiar with the talks. As things stand, Venezuela only has a limited volume of oil to export unless it can attract more investment to fix long-neglected oil fields, pipelines and port infrastructure.",2
3,2023-01-12,U.S. Inflation Slowed for Sixth Straight Month in December - WSJ,Consumer-price index rose 6.5% last month from a year earlier,"U.S. inflation eased in December for the sixth straight month following a mid-2022 peak as the Federal Reserve aggressively raised interest rates and the economy showed signs of cooling.The consumer-price index, a measurement of what consumers pay for goods and services, rose 6.5% last month from a year earlier, down from 7.1% in November and well below a 9.1% peak in June.Core CPI, which excludes volatile energy and food prices, climbed 5.7% in December from a year earlier, easing from a 6% gain in November. Many economists see increases in core CPI as a better signal of future inflation than the overall CPI. Core prices increased at a 3.1% annualized rate in the three months ended in December, the slowest pace in more than a year and down from 7.9% in June.The figures added to signs that inflation is turning a corner following last years surge. They also likely keep the Fed on track to reduce the size of interest-rate increases to a quarter-percentage-point at their meeting that concludes on Feb. 1, down from a half-percentage point increase in December.U.S. stocks climbed Thursday and investors bought U.S. Treasurys, lifting bond prices and weighing on yields. The S&amp;P 500 added 0.3%, while the Dow Jones Industrial Average gained 0.6%, or 217 points. The technology-heavy Nasdaq Composite also rose 0.6%.Easing inflation follows several signs that U.S. economic activity cooled in late 2022. U.S. imports and exports fell in November from October, while retail sales, manufacturing output and home sales all declined. Job and wage growth slowed in December, though the labor market remained tight with historically low claims for unemployment insurance at the start of the year.""The December CPI report was welcome good news after a very bad patch for inflation,"" said Bill Adams, chief economist at Comerica Bank. He said consumers are getting relief from lower gasoline prices and moderating food prices, as well as declining prices for other goods.On a monthly basis, the CPI fell 0.1% in December, due to sharply falling energy prices. That compared with a gain of 0.1% in November and 0.4% in October. Food-price increases also slowed last month. Core CPI rose 0.3% in December, up from Novembers 0.2% rise but down from 0.6% increases in August and September.Goods prices, a key driver of inflation over the past year and a half, fell for the third straight month in December as prices fell for products such as autos, computers and sporting goods.Improving supply chains and reduced demand have relieved price pressures on goods, but services prices continued to climb in part because of wage gains in a tight labor market.Some economists worry that still-high wage growth could keep consumers flush with cash and companies eager to raise prices to compensate, holding inflation above the Feds 2% target.""Taming services inflation will be the Feds biggest challenge this year,"" said Ryan Sweet, chief U.S. economist at Oxford Economics.Shelter prices rose 7.5% in December from a year earlier, the Labor Department said, and a broader measure of services prices that excludes utilities rose 7% during the same period. Both increases were the biggest since 1982.Daycare and preschool prices rose 5.4% in December from a year earlier, the biggest increase since 2006, while those for home-health care increased 6.1% in the same period. Hospital services prices, meanwhile, jumped 1.5% in December from the prior month, the sharpest monthly increase since 2015.Inflation remained high across the globe in November, though it abated during the month, the Organization for Economic Cooperation and Development said Tuesday. Consumer prices across the Group of 20 largest economies-which contribute four-fifths of economic output worldwide-rose 9% from a year earlier in November, down from Octobers 9.5% increase, the first drop in the G-20 inflation rate since August 2021.Prices rose sharply in 2021 as the U.S. economy rebounded from the Covid-19 pandemic, powered by pent-up consumer spending that got a boost from low interest rates and government stimulus. Snarled supply chains fueled higher prices for many goods. Russias invasion of Ukraine in early 2022 also tightened supplies of energy and other commodities, further stoking inflation worldwide.Inflation pressures on goods dissipated last summer as supply chains improved and energy prices fell. Shipping costs from China to the West Coast are near prepandemic levels. Gasoline prices have declined, with the national average price of regular unleaded gasoline at $3.27 a gallon on Thursday, down about 50 cents a gallon from mid-November, according to OPIS, an energy-data and analytics provider. Gasoline prices peaked in mid-June at a record $5.02 a gallon.""Logistics prices have also slowed materially, shipping costs are back to where they were pre-Covid,"" said Jake Oubina, senior economist at Piper Sandler. ""The alleviation on the cost side is creating the wherewithal to discount more aggressively as we head into 2023.""The clearest impact of Fed tightening so far is in the housing market. Existing-home sales fell in November for a 10th straight month as high mortgage rates boosted buyers costs.Ian Snowden, a 33-year-old tech salesman, said the shift to remote work after the pandemic hit allowed him to move to Asheville, N.C., where he has easy access to hiking, fishing and other outdoor activities.The move proved expensive, though. After losing out to cash buyers in bids for existing homes, Mr. Snowden signed a contract in September 2021 to buy a newly constructed property. By the time his home was completed the following June, mortgage rates had doubled. On top of that, the construction company told him that he was on the hook for an extra $25,000 to offset unexpectedly high costs for concrete, labor and other items-or he could back out of the contract.At that point, Mr. Snowden said, he was already selling his old house and had made plans to move, so he wasnt going to back out. ""So much was already in motion,"" he said. Between the higher mortgage rates and the additional costs, the monthly mortgage payment increased $200, he said.Austen Hufford contributed to this article.",3
4,,Sam Bankman-Fried Resurfaces With Fresh Defense of FTX Collapse on Substack,"Stock Market Today, Jan. 12: Stocks Close Higher After CPI Data","Sam Bankman-Fried is back online, using a new public forum to rally his defense.The founder of FTX launched ""SBFs Substack"" on Thursday, giving his take on the events leading to the crypto exchanges collapse. Mr. Bankman-Fried is under house arrest at his parents California home as he faces federal fraud charges. He has pleaded not guilty.""I didnt steal funds, and I certainly didnt stash billions away,"" he wrote in a post.His arguments, which appear to be an outline of his coming legal defense, mirror those Mr. Bankman-Fried posted on Twitter in the weeks before his arrest.Mr. Bankman-Fried wrote on his Substack:He compared FTX and Alamedas problems to those of Credit Suisse, whose shares plummeted last fall. ""At the end of the day, its run on the bank fell short. FTXs didnt.""Some of his assertions contradict federal prosecutors and Mr. Bankman-Frieds own former associates. At the end of the post, Mr. Bankman-Fried wrote, ""All of which is to say: no funds were stolen. Alameda lost money due to a market crash it was not adequately hedged for.""The Wall Street Journal has previously reported that FTX lent billions of dollars' worth of customer assets to fund risky bets by Alameda, and that the hedge fund's chief executive and senior FTX officials knew about that decision to send user funds to Alameda.The collapse of Mr. Bankman-Frieds hedge fund, Alameda Research, stemmed from a broad crypto market meltdown.He didn't run Alameda for the last few years.FTX could have raised fresh investor cash and made customers whole if it wasnt forced into bankruptcy.Alamedas insolvency stemmed from failure to hedge its positions and actions by rival exchange Binance.Alamedas contagion spread to FTX.",4
