,write_time,title,brief,content,href
5,2023-01-13,SEC Sues Crypto Firms Genesis and Gemini Over Lending Product - WSJ,"The program, called Gemini Earn, allegedly violated investor-protection laws","WASHINGTON-The Securities and Exchange Commission on Thursday sued Genesis Global Capital LLC and Gemini Trust Company LLC over a $900 million crypto-lending program that allegedly violated investor-protection laws.The SEC filed its civil lawsuit in Manhattan federal court alleging that Genesis should have registered the product, which would have required providing clients with detailed financial disclosures. The companies began marketing the program to individual investors in February 2021 and raised billions of dollars worth of crypto assets from hundreds of thousands of investors, the SEC said.Under the program, called Gemini Earn, customers of crypto exchange Gemini lent their crypto assets to crypto lender Genesis in exchange for interest payments as high as 8%. Gemini took a fee for arranging the loan, which sometimes reached as much as 4.29%, the SEC said.The two companies have been feuding since Genesis abruptly paused withdrawals from the program on Nov. 16 after it couldnt meet client redemption requests in the wake of crypto exchange FTXs collapse. At the time, Genesis held about $900 million in assets from 340,000 Gemini Earn customers, according to the SEC.The SECs lawsuit seeks fines and the return of profits that were illegally earned.""We look forward to defending ourselves against this manufactured parking ticket. And we will make sure this doesnt distract us from the important recovery work we are doing,"" Tyler Winklevoss, co-founder of Gemini, said in a tweet in response to the SEC suit. A spokeswoman for Genesis didnt comment.Since Genesis paused redemptions, Gemini has banded together with other creditors of Genesis, saying it wants to find a way for the crypto lender to return owed assets.In recent days, Cameron Winklevoss, who co-founded Gemini with brother Tyler, has ratcheted up the pressure on Genesis and its parent company, Digital Currency Group. Cameron Winklevoss traded barbs with Barry Silbert, chief executive of DCG, on Twitter last week. Cameron Winklevoss accused Mr. Silbert of ""bad faith stall tactics,"" and called for Mr. Silberts removal as CEO of the firm in two recent open letters posted on Twitter. A DCG spokeswoman has called the Winklevoss letters a ""desperate and unconstructive publicity stunt.""Genesis laid off 30% of its staff last week and is considering filing for bankruptcy, The Wall Street Journal recently reported. The crypto lender suffered steep losses from loans it supplied to the now-defunct trading firm Alameda Research and crypto hedge fund Three Arrows Capital. Both Alameda and Three Arrows filed for bankruptcy last year. Alameda is the sister trading firm of FTX.The lawsuit against Genesis and Gemini resembles another case that the SEC and several states filed over BlockFi Lending LLCs product, which allowed crypto traders to earn a yield for lending their digital assets. The SEC alleged that BlockFis interest-bearing accounts were securities and that the firm should have registered the product. BlockFi paid a $100 million fine to settle the allegations. The company didnt admit or deny wrongdoing.The newlawsuit is the second recentregulatory complaint filed against Gemini. The Commodity Futures Trading Commission also sued the crypto exchange last year.The CFTC said in its civil case that Gemini misled regulators as part of an effort to gain approval for bitcoin futures in 2017. Gemini denied the CFTCs claims at the time and said it would fight the allegations in court. The litigation is ongoing.Write to Dave Michaels at dave.michaels@wsj.com and Vicky Ge Huang at vicky.huang@wsj.com",5
6,2023-01-12,Activist Investor Nelson Peltz to Disneys New Board Chair: No Thanks - WSJ,Entertainment companys appointment of Nikes Mark Parker to Disney chairman puts a Bob Iger loyalist in control of succession,"Activist investor Nelson Peltz doesnt think the Walt Disney Co.s DIS <span class=""css-1hk2j0i-ChicletChange erm4ah13"">3.61%</span><span class=""css-jozwg9-Arrow erm4ah11""><span class=""css-1q7p60h-ArrowHiddenLabel erm4ah10"">increase; green up pointing triangle</span><svg height=""16"" viewbox=""0 0 16 16"" width=""16""><defs><path d=""M8.588 3.985l4.927 7.14-.506.86H3.02l-.534-.86 4.959-7.14z"" id=""arrow-down-filled-small_svg__a""></path></defs><use fill=""currentColor"" fill-rule=""evenodd"" transform=""rotate(-180 8.008 7.992)"" xlink:href=""#arrow-down-filled-small_svg__a""></use></svg></span> board leadership change will shift the direction of the company, saying the new chairman is little more than a rubber stamp for newly returned CEO Bob Iger, according to people familiar with the matter.On Thursday, Mr. Peltz and his hedge fund Trian Fund Management LP turned up the heat in their proxy battle, despite board changes the Walt Disney Co. made Wednesday in an effort to counter his push. Disney on Wednesday replaced its board chair Susan Arnold with Nike Inc. NKE <span class=""css-1hk2j0i-ChicletChange erm4ah13"">-0.04%</span><span class=""css-ule3a4-Arrow erm4ah11""><span class=""css-1q7p60h-ArrowHiddenLabel erm4ah10"">decrease; red down pointing triangle</span><svg height=""16"" viewbox=""0 0 16 16"" width=""16""><defs><path d=""M8.588 3.985l4.927 7.14-.506.86H3.02l-.534-.86 4.959-7.14z"" id=""arrow-down-filled-small_svg__a""></path></defs><use fill=""currentColor"" fill-rule=""evenodd"" transform=""rotate(-180 8.008 7.992)"" xlink:href=""#arrow-down-filled-small_svg__a""></use></svg></span> chairman Mark Parker, and assured investors that he would lead the search for the companys next chief executive.Mr. Peltz thinks Mr. Parker and the newly-returned Mr. Iger are too friendly for Mr. Parker to be truly objective, according to people familiar with Mr. Peltzs thinking. Mr. Peltz also thinks Mr. Parker has too many demands on his time and attention, given that he still serves as Nikes executive chairman, these people said.Wednesday night, the activist and his fund made their criticisms of Disneys performance public in an online presentation titled ""Restore the Magic"" followed by a proxy filing Thursday that detailed their assessment of a company in crisis due to what they describe as a series of self-inflicted wounds.They argued Disney has been hobbled by poor succession planning, ""over the top"" compensation, mismanagement of costs and flawed strategy. They criticized Disney for using its theme-parks revenue to subsidize its streaming losses and said Disneys acquisition of the 21st Century Fox Inc. assets put Disney in an unhealthy financial state. Foxs corporate sibling, News Corp, owns The Wall Street Journal.Disneys failure to persuade Mr. Peltz that the company is on the right track means that Mr. Iger faces a rockier road ahead in his first year back atop Disney, which already includes challenges such as a potential recession, a prolonged stock price slump, rising costs for content, potential layoffs and stiff competition in the streaming video business.It also highlights ongoing concerns among shareholders about Disneys leadership, strategy and succession plans. Six months ago, Disney fended off a challenge from another activist, Dan Loeb, who agreed to back off after the company appointed a director that Mr. Loeb had approved.Disney opposes placing Mr. Peltz on its board because the company thinks, in part, that the activist investor lacks experience in the media-and-entertainment space, according to people familiar with the companys thinking.The board also thinks that adding Mr. Peltz to its board would bring more disruption amid an already turbulent time for the company, as it navigates a new period with Mr. Iger back at the helm, people familiar with the matter said. Some shareholders voiced concerns about Disneys succession planning after Mr. Iger returned, the people said.Ms. Arnold retiring as chairwoman had been in the works with her 15-year term limit nearly up and wasnt meant to be a reaction to Mr. Peltzs campaign, the people said. Disneys bylaws limit nonmanagement directors to 15 total years on the board, after which they arent permitted to stand for re-election.Mr. Iger reclaimed the CEO spot at Disney in November, when the companys board fired Bob Chapek. The ouster came as Mr. Peltz was amassing Disney shares, and communicating with Mr. Chapek about his stake, according to Trians proxy materials.Mr. Peltzs fund has now amassed a more than $900 million stake, which will likely grow larger, according to people familiar with the matter. He said in the online presentation he doesnt want to replace Mr. Iger, but is seeking a board seat and wants a CEO named within two years.Disney said Wednesday that while members of its senior leadership team have engaged with Mr. Peltz numerous times over the past few months, the board is asking shareholders to vote against him at the coming annual meeting. Disney also asked shareholders to reinstate the current board of directors of the company-minus Ms. Arnold.In the presentation on Trians website, Mr. Peltzs fund highlighted what it described as mistakes made by the board, and compared Disneys shareholder returns to the broader market during the tenure of each director. Mr. Parkers seven years on the board have seen Disneys performance trail the S&amp;P 500 by 128 percentage points, a wider margin than for any other director, the presentation said.""There are still several current directors and members of management who oversaw and approved some of Disneys worst corporate governance and strategic failures,"" Trian wrote.Mr. Iger has long admired Mr. Parker as an executive andhas felt that Nike and Disney have similar leadership needs, according to people familiar with the matter. The two men have a close professional relationship, they said. Mr. Iger has told associates that he considers Mr. Parker, who in 1983 designed the Nike Pegasus running shoe, a ""creative executive"" and praised his steering of Nikes business toward a more digital-focused e-commerce model. The path tracks Disneys own pivot to streaming video and recent emphasis on smartphone apps and data-driven sales practices. The two men have also bonded over being fitness buffs, people familiar with the matter said.There are five other people who serve as board chairs at two companies simultaneously, according to governance research firm Equilar, Inc.""This is going to take an awful lot of work,"" said Charles Elson, founding director at the Weinberg Center for Corporate Governance at the University of Delaware.Mr. Peltzs campaign is rooted in his belief that Disneys board and senior management have made a series of high-profile missteps over the last year. Mr. Iger has also criticized several of the Disney boards moves, according to people familiar with the matter.Last year, some Disney directors began to discuss whether Mr. Chapek could recover after a war of words with Republican Florida Gov. Ron DeSantis over an education bill, according to people familiar with the matter. Some board members discussed appointing Mr. Parker as interim CEO, the people said.In early June, after Mr. Chapek fired a top deputy, Ms. Arnold released a statement saying that Mr. Chapek had the full support of the board. Later that month, the board renewed Mr. Chapeks contract through the end of 2024, over the objections of at least two directors who needed to be persuaded Mr. Chapek was still the right man for the job, The Wall Street Journal previously reported.Mr. Iger told friends at the time that he couldnt understand why Ms. Arnold was so unwavering in her support for Mr. Chapek, despite what he viewed as clear signs that Mr. Chapek wasnt leading Disney successfully, according to people familiar with the matter. Last summer, as the company veered into crisis, Mr. Peltz and his wife dined with Mr. Chapek and his wife at Disneyland Paris, where the activist investor told the then-CEO that he was interested in joining the board and offering a fresh perspective, according to Trians proxy materials.Mr. Peltz also told two other Disney directors, Oracle Corp. CEO Safra Catz and Procter &amp; Gamble Co. board member Amy Chang, that he wanted to join the board ""to help turn around the Company and drive long-term shareholder value,"" according to Trians proxy materials.Those discussions didnt go anywhere until early November, when Disneys share price plummeted following a weaker-than-expected quarterly earnings report, according to Trians proxy materials. Mr. Peltz pounced, quickly accumulating more than $800 million worth of Disney stock. A few days later, he contacted Mr. Chapek to initiate a formal dialogue.Over the last week, Disney and Mr. Peltz have met to try to reach an agreement that would avoid a proxy fight, to no avail. Ms. Arnold called Mr. Peltz on Wednesday to offer him a view into the board, but not a seat on the board, and Mr. Peltz declined, according to Trians proxy materials.",6
7,2023-01-12,Climate Startup Removes Carbon From Open Air in Industry First - WSJ,Climeworks cashes in on new technology by selling carbon credits to Microsoft and others,"One of the most important technologies to address climate change got a boost Thursday when a startup said it pulled carbon dioxide from the open air and stored it underground. The company has cashed in on the effort, potentially creating a viable business model that could kick-start a new industry.Climeworks AG is a leader in the race to remove carbon dioxide from the atmosphere, using a process known as direct-air capture. Customers, including Microsoft Corp., paid a significant premium to buy carbon credits generated by Climeworks, allowing them to effectively offset their own emissions.Climeworks and others have long promised that using vacuum-like devices to pull in air, filter it and bury carbon underground can help mitigate environmental damage caused by human activities. This is the first time a company has actually done it at a meaningful scale using a third-party verified process.""We hope we are growing from a teenager to a grown-up in this industry,"" Christoph Gebald, co-chief executive of Climeworks, said in an interview.Founded in 2009, Climeworks is effectively carrying out what trees do by taking carbon dioxide out of the atmosphere. The process promises to store the carbon in the earth for thousands of years. The company makes money by removing the carbon on behalf of businesses that can claim they are becoming carbon neutral.Microsoft, e-commerce company Shopify Inc. and payments firm Stripe Inc. have prepaid or agreed to pay hundreds of dollars per credit, each of which represents one metric ton of carbon removed. Other carbon credits tied to projects such as keeping trees standing have often been criticized because the projects often dont reduce emissions as much as promised.Companies pay a premium, sometimes paying hundreds of times as much as they do for basic credits, for the credits from Climeworks because there is more certainty they remove carbon from the atmosphere. The companies are also willing to pay more to help jump-start the industry, hoping that costs decline rapidly.""This is an important inflection point in the development of direct-air capture,"" said Stacy Kauk, Shopifys head of sustainability. ""It isnt just science fiction. Its reality.""The promise of the technology has prompted established businesses such as Occidental Petroleum Corp. to develop their own direct-air capture strategies.Climeworks operates one of the worlds only operational direct-air capture plants in Iceland, which is capable of removing about 4,000 metric tons of carbon dioxide a year, roughly equivalent to the annual emissions of about 800 passenger cars. Other removals to this point had been done using methods such as burying carbon-rich plant material underground.Climeworks declined to say how much carbon it removed. Businesses globally have agreed to purchase credits equivalent to more than 700,000 metric tons of carbon removal from it and other companies, according to data provider CDR.fyi. Scientists estimate billions of metric tons a year need to be removed annually by midcentury to avoid the worst effects of global warming.Bigger companies and investors are flocking to the industry. Occidental recently said it aims to increase the number of planned direct-air-capture facilities it operates to 100 from 70 by 2035, aided by bolstered tax credits that are part of the climate, health and spending legislation known as the Inflation Reduction Act.The tax credits are now up to $180 per metric ton of removal. Occidental is working with a startup on its first large facility in the Texas Permian Basin. Airbus SE has committed to buy several hundred thousand credits of removal tied to the project.How effective do you think carbon removal will be at fighting climate change? Join the conversation below.</em>Climeworks raised about $650 million in equity from investors including Singapore sovereign-wealth fund GIC Pte. Ltd. and private-equity firm Partners Group Holding AG early last year. It has also raised debt from Microsofts $1 billion climate-innovation fund.The company is building a second facility in Iceland that will be capable of removing about 36,000 metric tons a year.It is eyeing U.S. expansion with the government doling out about $3.5 billion through the 2021 infrastructure bill to develop four regional direct-air capture hubs. The European Union is also taking steps to grow the sector.""The support that governments have provided is a game changer,"" said Zeke Hausfather, Stripes climate-research lead.Carbon removal differs from efforts that capture carbon in factory smokestacks, which are being proposed by energy companies. Carbon removal is one of the potential technological solutions to climate change, but it will be decades before it makes a dent in the greenhouse gases in the atmosphere, and critics say it could provide an excuse for business-as-usual policies on fossil fuels.Skeptics question using huge amounts of energy and resources to build massive machines in the name of fighting climate change. Climeworks Iceland facility runs on renewable geothermal energy-meaning its associated emissions are minimal-and a different startup pumps the carbon underground after dissolving it in vast amounts of water.Industry executives say that direct-air capture is one of the few solutions for large-scale carbon removal that can mitigate unavoidable emissions and that costs will come down as the industry matures.They hope for a future where people pay for carbon removal like how they pay for trash collection. To make that point, Jan Wurzbacher, co-CEO of Climeworks, threw trash bags on stage during a talk a few years ago in London.",7
8,2023-01-12,Chinas Junk-Bond Market Creaks Open With a $400 Million Sale - WSJ,Dalian Wanda Commercial Management Groups transaction could inspire other real-estate firms to make offerings,"HONG KONG-A Chinese commercial property company sold U.S. dollar bonds on Thursday with yields topping 12%, reopening the market for junk debt from the country after a wave of defaults last year.Dalian Wanda Commercial Management Group Co., which operates shopping malls across China and is controlled by Chinese billionaire Wang Jianlin, tested investors appetite for risk this week with a two-year bond offering by one of its units.The unit sold bonds with a $400 million face value and an 11% coupon. The securities were sold at 97.6 cents on the dollar, which enabled the deal to be priced to yield 12.375%. The new debt was rated BB by Fitch Ratings and Ba3 by Moodys Investors Service, levels that sit in the highest category of speculative-grade ratings.The transaction could inspire other Chinese real-estate firms to come back to the table to discuss potential deals, some investment bankers predicted. But Leonard Law, a senior credit analyst at research firm Lucror Analytics, said investors should be wary about reading too much into the deal.""I cant definitely say that the offshore bond market has reopened for property developers,"" Mr. Law said.Many investors dumped Chinese high-yield dollar bonds last year, after residential-property giants China Evergrande Group, Kaisa Group, Sunac China and many of their peers defaulted on their international debt. New junk-debt issuance slowed to a trickle as bond prices collapsed and yields soared, making it too costly for most companies to borrow.The average yield on outstanding junk dollar bonds from Chinese companies that havent defaulted hit a record high of 33% in October 2022, according to an ICE BofA index that tracks them.In November, Chinese authorities unveiled a series of measures designed to help surviving property developers obtain access to financing, lowering their default risk and sparking a junk-bond rally. That has taken the average yield for sub-investment-grade Chinese dollar bonds down to about 17%.Dalian Wanda Commercial Management Groups business is different from that of residential apartment sellers such as Country Garden Holdings Co. and its peers. The former describes itself as the worlds largest commercial-properties holding, managing and operating enterprise, that manages hundreds of Wanda Plazas across China. Proceeds from the debt sale, which was led by Credit Suisse, will help refinance the groups existing debt.While sales of Asian investment-grade bonds have been on a tear so far this year, investors are likely to remain cautious when it comes to high-yield bonds, said Freddy Wong, head of Asia Pacific fixed income at Invesco.Any fresh issuance in the Chinese dollar junk-bond market will be skewed toward companies with stable fundamentals, he said. ""For now, the market is not telling you that they are fully ready,"" Mr. Wong added.Matthew Thomas contributed to this article.",8
